<person xmlns:xsi="http://www.w3.org/2001/XMLSchema-instance" xmlns="http://graph.x.ql" xsi:type="gxql:Hero" xsi:schemaLocation="/graphxql/person.xsd">
    <name>Luke</name>
    <height>180</height>
    <appearsIn>Return of the Jedi</appearsIn>
    <friends>
        <id>6</id>
    </friends>
    <foes>
        <id>2</id>
        <id>3</id>
        <id>4</id>
        <id>5</id>
    </foes>
</person>