<person xmlns:xsi="http://www.w3.org/2001/XMLSchema-instance" xmlns="http://graph.x.ql" xmlns:gxql="http://graph.x.ql" xsi:type="gxql:Hero" xsi:schemaLocation="/graphxql/person.xsd">
    <name>Luke</name>
    <height>180</height>
    <appearsIn>Return of the Jedi</appearsIn>
    <friends>
        <person>
            <id>6</id>
        </person>
    </friends>
    <foes>
        <person>
            <id>2</id>
        </person>
        <person>
            <id>3</id>
        </person>
        <person>
            <id>4</id>
        </person>
        <person>
            <id>5</id>
        </person>
    </foes>
</person>