<person xmlns:xsi="http://www.w3.org/2001/XMLSchema-instance" xmlns="http://graph.x.ql" xsi:type="gxql:Foe" xsi:schemaLocation="/graphxql/person.xsd">
    <name>Joe</name>
    <height>180</height>
    <appearsIn>Return of the Jedi</appearsIn>
    <friends>
        <id>7</id>
    </friends>
    <accomplices>
        <id>3</id>
        <id>4</id>
        <id>5</id>
    </accomplices>
</person>